Rule,Category,Example,Score
A_BUT,Possible Typo,So I confused things a but and it was Kai who had planned that.,80
A_GREAT_NUMBER_OF_NN,Grammar,A great number of problem have arisen.,50
A_HUNDREDS,Grammar,A hundreds people were in the store.,50
A_INFINITVE,Grammar,a compete catastrophe.,50
A_KNOW_BUG,Possible Typo,This is a know problem.,80
A_LOT_OF_NN,Grammar,I have a lot of car.,50
A_MUCH_NN1,Grammar,This will be a much work.,50
A_MY,Collocations,The my car is on the maintenance services.,
A_PLURAL,Grammar,I needed to use a text line as a criteria to select users for a list.,50
,,The Syria resolution was a major milestones for the United Nations.,
A_RB_NN,Grammar,This is a philosophically question.,50
A_TRIP_TO,Collocations,John and Jenny week decided to go on a trip in New York.,
,,John and Jenny week decided to go on a trip in New-York.,
,,John and Jenny week decided to go on a trip in York.,
A_UNCOUNTABLE,Grammar,A good knowledge is power.,50
,,A knowledge is power.,
,,A nice accommodation is too expensive.,
,,A very good knowledge is too time-consuming.,
,,A very nice accommodation is too expensive.,
,,An accommodation is too expensive.,
A_WAS,Possible Typo,But is there a was to work around the problem?,80
ABOUT_ITS_NN,Possible Typo,The frog told a story about it's happy childhood in the river.,80
ABOUT_WHO_TO,Possible Typo,What do you think about who to promote?,80
ABSOLUTELY_ESSENTIAL,Redundant Phrases,This is absolutely essential.,
ABSORB_AT_IN,Collocations,I am absorbed at this book.,
ABUNDANCE,Plain English,There is an abundance of flowers in the meadow.,
ACCEDE_TO,Plain English,He acceded to our demands.,
ACCELERATE,Plain English,The car accelerated from traffic lights,
ACCENTUATE,Plain English,The harsh light accentuated the ruggedness of the landscape.,
ACCEPT_EXCEPT,Commonly Confused Words,Please except my apologies.,
,,Police found the culprits (accept one).,
,,This is done accept for that fact that we still have JBossws 2.0.0 binaries.,
ACCOMMODATION,Plain English,Accommodation available.,
ACCOMPANY,Plain English,You need to accompany him.,
ACCOMPANY_WITH,Collocations,Land reclamation is always accompany with pollution.,
ACCOMPLISH,Plain English,Accomplish your work!,
ACCORDING_TO,Grammar,"According about a recent survey, most smokers suffer from cancer.",50
ACCORDING_TO_ME,Grammar,"According to me, this is a great movie.",50
ACCOUNTS_FOR,Collocations,That accounts a rise in price.,
ACCRUE,Plain English,The deposit accrued interest.,
ACCURATE,Plain English,We need accurate information.,
ACCUSE_FOR_OF,Collocations,He is accused for fraud.,
ACCUSE_FOR_OFF,Collocations,She accused the man for stealing.,
ACCUSED_OF_A_CHARGE_CHARGED_WITH,Redundant Phrases,The Magistrate's Court in Kuala Lumpur today decided that a former model accused of a charge of public indecency is fit to stand trial.,
ACCUSTOM_WITH_TO,Collocations,The mechanic is accustomed with handling those situations.,
ACCUSTOMED_TO,Grammar,He is accustomed of playing football now.,50
ACQUIRE,Plain English,He acquired all the tools he needed.,
ACTUAL_EXPERIENCE,Redundant Phrases,This talk is based on actual experience gained during recovery operations following a fire at the Washington National Records.,
AD_NAUSEUM,Possible Typo,The song was playing ad nauseum.,80
ADD_AN_ADDITIONAL,Redundant Phrases,How to Add an Additional Page to a Full Flash Site,
ADDED_BONUS,Redundant Phrases,Added bonus: booting from cdrom.,
ADDICTION_TO_OF,Collocations,I would like to work with people who have an addiction of drugs.,
ADEQUATE_ENOUGH,Redundant Phrases,The Allen test is not adequate enough for the screening of hand circulation.,
ADJECTIVE_IN_ATTRIBUTE,Redundant Phrases,The man is big in size.,
ADMIN_ADMIT,Commonly Confused Words,I must admin that my code is not perfect.,
ADMIT_ENJOY_VB,Grammar,I am accustomed to run.,50
,,I am used to run. I run every day for 30 minutes.,
,,I consider to run my favourite sport.,
,,I enjoy to run.,
,,I look forward to see you.,
,,I regret to read this book.,
,,I'm used to run. I run every day for 30 minutes.,
ADMITTED_AT_TO,Collocations,"On his way to an interview to be admitted at Princeton College, Quentin and his childhood best friend James arrive on a crime scene where they find the corpse of the man who was supposed to interview the former, along with a very nonchalant paramedic.",
ADOPT_TO,Commonly Confused Words,Maybe you will need time to adopt to the situation.,
ADVANCE_PLANNING,Redundant Phrases,Advance planning is one strategy couples can use to establish legal rights.,
ADVERB_WORD_ORDER,Grammar,Always I am happy.,50
,,Ever it was thus.,
,,I always will love you.,
,,I am happy always.,
,,I am here and I sometimes am happy.,
,,I go often to bed before midnight.,
,,I sometimes am happy.,
,,They have been often seen together.,
,,They have been seen often together.,
,,They often have been seen together.,
ADVERSE_AVERSE,Commonly Confused Words,Are you adverse to eating horse meat?,
ADVERTISEMENT_OF_FOR,Collocations,Nice advertisement of your company.,
ADVICE_ADVISE,Commonly Confused Words,We advice you to do it.,
ADVISE_VBG,Grammar,All he did was to help carrying the bags.,50
,,All he did was to help not carrying the bags.,
,,All he did was to help us getting on the bus.,
,,All he did was to help us not staying calm.,
,,He advised not staying calm.,
,,He advised staying calm.,
,,He advised us not staying calm.,
,,He advised us staying calm.,
,,He helped not buying some crap.,
,,He helped us getting on the bus.,
,,He helped us not staying calm.,
AFFECT_EFFECT,Commonly Confused Words,A side affect of global warming,
,,A side-affect of global warming,
,,It had the same affect on me.,
,,Parking Fees are in affect in this park.,
,,Regional factors have an affect on hotel guest satisfaction.,
,,She was badly effected.,
,,That might adversely effect the bottom line.,
,,That might effect the bottom line.,
,,The ban took affect at midnight.,
,,The experiment didn't obey the laws of cause and affect.,
,,The laws had an immediate affect.,
,,The medicine shouldn't effect the baby.,
,,The medicine would've effected the baby.,
,,The primary affect on property values.,
,,The side affects of global warming,
,,There was a law with immediate affects.,
,,"We tried appeasing the rain gods, but to no affect.",
AFFORD_VB,Grammar,We cannot afford not spend the whole month in the Alps.,50
,,We cannot afford spend the whole month in the Alps.,
AFFORD_VBG,Grammar,We cannot afford not spending the whole month in the Alps.,50
,,We cannot afford spending the whole month in the Alps.,
AFRAID_FROM_OF,Collocations,Rats are afraid from cats.,
AFRAID_OF_HEIGHT,Grammar,I'm afraid of dark.,50
,,I'm afraid of open space.,
,,I'm afraid of spider.,
AFTER_BEEN,Possible Typo,"After been assaulted, the man was often wary.",80
AFTERALL,Possible Typo,"Afterall, there isn't any food to be had in this country.",80
AGREE_WITH_THE_FACT,Redundant Phrases,I agree with the fact that the sky is blue.,
,,We did not disagree with the fact that the sky is blue.,
AGREEMENT_QUESTION,Grammar,Do your father live in England?,50
,,Does your parents live in England?,
,,Has your parents told you everything?,
,,Have your father lived in England?,
,,Where is your dogs?,
AGREEMENT_SENT_START,Grammar,Both element are red.,50
,,Both of them believes in God.,
,,Cars is useful.,
,,Cats sleeps more than 15 hours per day.,
,,"Do you know what the dogs, which are specially trained to detect organic matter, eats?",
,,"Do you know whether the users from Asia, for example, wants to learn English?",
,,Each of the children are happy.,
,,"He asked whether the black dogs, mostly dachshunds and terrier mixes, barks loudly.",
,,"He asked whether the dogs of war, mostly dachshunds and terrier mixes, barks loudly.",
,,How can we know whether the black dogs barks loudly?,
,,Is this the house in which the dogs of war sleeps each night?,
,,Many users in Asia wants to learn English.,
,,"Many users in Asia, for example, wants to learn English.",
,,She asked whether the users from Asia wants to learn English.,
,,She wanted to know whether the dogs barks loudly.,
,,The black dogs barks loudly.,
,,"The black dogs, mostly dachshunds and terrier mixes, barks loudly.",
,,The dogs barks loudly.,
,,The dogs is released.,
,,The dogs of war barks loudly.,
,,The dogs of war is released.,
,,The dogs of war was released.,
,,"The dogs of war, finally, is released.",
,,"The dogs of war, however, was released.",
,,"The dogs of war, mostly dachshunds and terrier mixes, barks loudly.",
,,The dogs was released.,
,,"The dogs, Bob and Ben, is released.",
,,"The dogs, Bob and Ben, was released.",
,,"The dogs, which are specially trained to detect organic matter, patrols the nearly 4,000 vehicles.",
,,The teacher and her students is in the classroom.,
,,This infrared radiation rises into the atmosphere where gases prevents the infrared radiation from escaping into space.,
,,"This infrared radiation rises into the atmosphere where gases, such as carbon dioxide, prevents the infrared radiation from escaping into space.",
,,Tina and her father sings a song.,
,,What happened when the dogs of war was released.,
,,"What happened when the dogs of war, two dachshunds, was released.",
,,What happened when the dogs was released?,
,,"What happened when the dogs, Bob and Ben, was released.",
,,What happens when the dogs is released?,
,,What happens when the dogs of war is released.,
,,"What happens when the dogs of war, finally, is released.",
,,"What happens when the dogs, Bob and Ben, is released?",
AGREEMENT_THEIR_HIS,Grammar,Each child needs their parents.,50
,,Each of the boys likes their new teacher.,
AH_HA,Possible Typo,"After that we had an ""ah ha"" moment and that was it.",80
AIM_ON_AT,Collocations,This tool is aimed on regular users.,
AIRPLANE_HANGER,Commonly Confused Words,These are airplane hangers.,
ALA_MODE,Possible Typo,He loves his pie ala mode.,80
ALBUM_COMPRISED_OF,Possible Typo,This is an album comprised of of great songs.,80
ALL_AND_ALL,Nonstandard Phrases,All and all it’s just another brick in the… toilet?,
ALL_BE_IT,Possible Typo,The good news is that there are several redeeming factors to (all be it barely).,80
ALL_FOR_NOT,Commonly Confused Words,My farmer pants were all for not...,
ALL_MOST,Possible Typo,All most all the patents were rejected...,80
ALL_MOST_SOME_OF_NOUN,Grammar,All of students like mathematics.,50
ALL_OF_THE,Redundant Phrases,She is going to all of the parks.,
ALL_OF_THE_SUDDEN,Nonstandard Phrases,Why would a man all of the sudden send flowers?,
,,Why would a man all the sudden send flowers?,
ALL_OVER_THE_WORD,Possible Typo,The company employs over 25 000 people all over the word.,80
ALL_READY,Possible Typo,I have all ready bought it.,80
,,I've all ready bought it.,
ALL_THE_FARTHER,Possible Typo,The town was all the farther than the border.,80
ALL_THE_FURTHER,Commonly Confused Words,That's all the further I'll go.,
ALL_THINGS_CONSIDERED,Plain English,"All things considered, Connecticut's woodlands are in better shape now than ever before.",
ALL_WAYS,Possible Typo,He all ways takes the last piece of cake.,80
ALLOT_OF,Possible Typo,I've got allot of questions to you.,80
ALLOW_TO,Grammar,It allowed to see better.,50
,,It allows to see better.,
ALLOW_TO_DO,Grammar,He allowed me do it on my own.,50
ALLTHOUGH,Possible Typo,"All though I liked the book, I had to stop reading it.",80
,,All though the day: a song by Anita O'Day.,
ALLUDE_ELUDE,Possible Typo,Her failure to allude the school bullies is evident.,80
ALLY_ALLAY,Commonly Confused Words,I would like to ally concern.,
ALONG_SIDE,Possible Typo,The car pulled up along side.,80
ALONG_THE_LINES_OF,Plain English,I think my point is very much along the lines of his.,
ALONG_THE_SAME_VEIN,Nonstandard Phrases,I've been working along the same vein.,
ALONG_TIME,Possible Typo,After along time the lovers were reunited.,80
ALREADY_ALL_READY,Commonly Confused Words,Are you already?,
,,The device is all ready available in Korea.,
ALSO_KNOW,Possible Typo,He is also know as the first Chechen writer.,80
ALSO_OTHER,Redundant Phrases,"However, there are also other marbles in the jar.",
ALSO_SENT_END,Style,You will buy some eggs also.,
ALTER_BOY,Commonly Confused Words,Forty-seven percent of executives said they were concerned that retiring Boomers will significantly altar the workforce in the next decade.,
,,He was an alter boy.,
,,He was at the alter.,
AM_I,Grammar,Whom am talking with?,50
AM_IN_THE_MORNING,Redundant Phrases,It's 5 A.M. in the morning.,
,,It's 5 AM in the morning.,
AM_LOATHE_TO,Possible Typo,I am loathe to continue this conversation.,80
AM_PM,Redundant Phrases,"It's 7,30 p.m.",
AM_PM_OCLOCK,Redundant Phrases,It's 7 o'clock a.m.,
,,It's 7 o'clock AM.,
AMENABLE_AMENDABLE,Commonly Confused Words,You must be amendable to compromise.,
AN_ANOTHER,Grammar,It's an another lonely night.,50
AN_INVITE,Style,Is that an invite...?,
AN_THEN,Possible Typo,Tonight I'm going to eat dinner at Alyssa's an then go to Christina's.,80
ANALYSIS_ABOUT,Collocations,Read the analysis about the results.,
ANALYSIS_IF,Possible Typo,An Analysis if Rock Music,80
And,Style,"And yes, it shows a lack of style to start a sentence with 'and'.",
AND_ALSO,Redundant Phrases,Typical English Food and also Welsh and Scottish too,
AND_END,Grammar,Is he at the and?,50
AND_ETC,Redundant Phrases,E-Commerce and etc.,
AND_SO_FOURTH,Possible Typo,And so on and so fourth.,80
AND_SO_ONE,Possible Typo,We think it helps to find bottlenecks and so one.,80
AND_THAN,Commonly Confused Words,How to add equal values and than replace them with their sum?,
ANGRY_AGAINST_WITH,Collocations,Birds fly when they are angry against pigs.,
ANGRY_WITH_ABOUT,Collocations,Barbie is angry with the situation.,
ANINFOR_EVERY_DAY,Possible Typo,These shoes are great for every day wear.,80
,,You shouldn’t wear an every day outfit to the wedding.,
ANNUAL_ANNIVERSARY,Redundant Phrases,First Annual Anniversary Contest,
ANOTHER_WORDS,Possible Typo,"Another words, he is an ideal husband.",80
ANXIOUS_OF_ABOUT,Collocations,They are anxious for his health.,
ANY_BODY,Possible Typo,Any one needs help here?,80
,,No body seems to care.,
ANY_WHERE,Possible Typo,Put your stuff down any where.,80
APART_A_PART,Possible Typo,I'd like to be apart of your team.,80
,,We set it apart of other religions.,
APART_FORM,Possible Typo,Christianity was set apart form other religions.,80
APOS_ARE,Punctuation Errors,The car's are cheap.,
APOS_RE,Possible Typo,We don'T need this.,80
,,We'Re looking forward to our meeting.,
APOSTROPHE_IN_DATES,Typography,Hillary Clinton asked where Bernie Sanders was in the 1990's.,
APOSTROPHE_PLURAL,Possible Typo,7 reason's why,80
,,7 reasons why teacher's found us top class,
APPLY_FOR,Collocations,You try and apply for another University!,
APPLY_TO,Collocations,You can apply to welfare.,
APPROXIMATELY_ABOUT,Redundant Phrases,Americans feel full of energy and healthy approximately about 19 days per month.,
ARCHITECT_VERB,Commonly Confused Words,I would like to architect a house,
ARE_ABLE_TO,Redundant Phrases,"Yes, there are some species of frogs that are able to throw up their entire stomach and wipe it off with their legs.",
ARE_STILL_THE_SOME,Possible Typo,That means that tires are still the some of the most important components of your vehicle.,80
AREA_COMPRISED_OF,Possible Typo,The Tenderloin is an area comprised of the seedy sort.,80
ARMED_GUNMAN,Redundant Phrases,Armed gunmen entered the room to kill Bill.,
ARRIVAL_TO_THE_HOUSE,Collocations,"At that time, their arrival to the house was a surprise.",
,,Their arrival to the city will be at one o'clock.,
ARRIVE_AT_IN,Collocations,They will arrive at the city at 9:00 am.,
ARRIVE_NNP,Grammar,I would like to arrive Dallas next day.,50
ARRIVE_ON_AT_THE_BEACH,Collocations,"When John arrived on the beach, he went for a swim.",
ARRIVED_IN,Collocations,Arrive in the downtown.,
ARTICLE_ADJECTIVE_OF,Grammar,We are not responsible for the delusional of your client.,50
ARTICLE_MISSING,Grammar,About large boat.,50
,,About month before I left it was discussed...,
,,ACET would not be able to reclaim tax on covenant.,
,,Change your filter after week.,
,,He does lot of things.,
,,He gives brother a bar of chocolate.,
,,He goes step too far.,
,,He is experienced soldier.,
,,He is extremely experienced soldier.,
,,He is friend.,
,,He is good friend.,
,,He is talking about friend.,
,,He is talking about good friend.,
,,He is talking of such friend.,
,,He is talking of such good friend.,
,,He takes brother with him.,
,,He was waiting at airport.,
,,He was waiting at new airport.,
,,He was waiting by river.,
,,He was waiting by small river.,
,,He was waiting for answer.,
,,He was waiting for swift answer.,
,,He was waiting in large lobby.,
,,He was waiting in lobby.,
,,It falls tad.,
,,Recently I have experienced problem.,
,,Recently I have experienced serious problem.,
,,The dog spent all day in kitchen.,
,,This remark is on previous page.,
ARTICLE_UNNECESSARY,Grammar,I need a oil for my car.,50
AS_A_MATTER_OF_FACT,Plain English,"As a matter of fact, dry-bulb temperature indicates the amount of heat in the air.",
AS_ADJ_AS,Grammar,This house is as big than mine.,50
AS_FOLLOW,Possible Typo,The main points are as follow:,80
AS_FOLLOW_AS_FOLLOWS,Possible Typo,We can elaborate this distinction as follow.,80
AS_OF_YET,Redundant Phrases,The report remains unfinished as of yet.,
AS_OPPOSE_TO_AS_OPPOSED_TO,Possible Typo,"Professional sports, as oppose to amateur sports , are sport s in which athletes receive payment for their performance",80
AS_PER,Plain English,"As per usual, he came late to work.",
AS_TIME_PROGRESSED,Possible Typo,"As time progressed, the sisters got wiser.",80
AS_WELL_AS_BETTER,Commonly Confused Words,As well or better than,
ASCETIC_ACID,Commonly Confused Words,There was a spill of ascetic acid.,
ASHAMED_FROM,Collocations,"After flunking in the exam, she felt ashamed from it.",
ASK_NO_PREPOSITION,Grammar,She asked to me whether I like cats.,50
ASK_THE_QUESTION,Redundant Phrases,He asked the question whether it's OK to add some rules to LanguageTool.,
ASK_TO,Collocations,Ask to all the employees.,
ASK_WETHER,Commonly Confused Words,Don't ask me wether it is already decided!,
ASSIST_ASSISTANCE,Plain English,Do you need any assistance?,
ASSOCIATE_TOGETHER,Redundant Phrases,Hippos associate together in groups.,
,,"Poets and choregi having been associated together in pairs, there still remained the selection and appointment of the actors.",
ASSOCIATES_TO,Collocations,She associates her layoff to your arrival.,
AT_ALL_TIMES,Plain English,Kingfisher can be found near water at all times,
AT_IN_THE_KITCHEN,Collocations,The plant is at the kitchen.,
AT_IN_THE_MORNING,Collocations,I like to do soccer on the evening.,
AT_OVER_THE_WEEKEND,Collocations,I like to do soccer on the weekend.,
AT_THE_JOB,Collocations,He does personal stuff at the job.,
AT_THE_REIGNS,Possible Typo,The coachman held the reigns with expertise.,80
AT_TIME,Grammar,She came on 7 o'clock.,50
,,She came on 7:30 p.m.,
AT_YOUR_EARLIEST_CONVENIENCE,Plain English,Please come at your earliest convenience.,
ATM_MACHINE,Redundant Phrases,ATM Machine Comparison Guide,
AUTOBIOGRAPHY_OF_A_LIFE,Redundant Phrases,"In this autobiography of a life of courage and love, we get to share in the compelling story of a family’s struggles.",
AWAITING_FOR,Commonly Confused Words,He was awaiting for a person.,
AWAY_FRO,Possible Typo,He is away fro the sea.,80
AXED_ASKED,Commonly Confused Words,He axed me to dinner.,
BACK_ABACK,Commonly Confused Words,He was totally taken back by my response.,
BACK_AND_FOURTH,Commonly Confused Words,How to move back and fourth from linux to xmb?,
BACK_FIRE,Possible Typo,His plans always back fire.,80
BACK_IN_FORTH,Commonly Confused Words,I've been texting back in forth with him for the past 3 days.,
BAITED_BREATH,Possible Typo,We are waiting with baited breath.,80
BALD-HEADED,Redundant Phrases,He is bald-headed.,
BALSA_WOOD,Redundant Phrases,It's made of balsa wood.,
BAND_COMPRISED_OF,Possible Typo,The Beatles were a band comprised of great musicians.,80
BAR_B_QUE,Commonly Confused Words,A casual summer bar-b-queue.,
BARE_IN_MIND,Possible Typo,Bare in mind that we're alone.,80
BARE_NAKED,Redundant Phrases,The old man ran bare naked through the streets.,
BASE_FORM,Grammar,I really likes cats.,50
BASIC_FUNDAMENTALS,Redundant Phrases,Let’s get back to the basic fundamentals!,
BASIS_ON_A,Plain English,We have been coming here on a regular basis for years.,
BE_A_X_ONE,Plain English,This test is an easy one.,
BE_ADVISED,Plain English,You are advised look after your belongings.,
BE_ALOUD_TO,Commonly Confused Words,Who is aloud to get information from your mail?,
BE_CAUSE,Possible Typo,It was all be cause of you.,80
BE_FINED_WITH,Grammar,I'm fined with that.,50
BE_FOND_TO,Grammar,Children are fond to skipping.,50
BE_I_BE_GERUND,Grammar,What was I am doing again?,50
BE_IN_UNDER_PRESSURE,Collocations,Kelly is in pressure.,
BE_INTEREST_IN,Grammar,I am interesting in this book.,50
BE_ON_IN_SHOCK,Collocations,We were on shock when it happen..,
BE_USE_TO_DO,Grammar,He is use to a vegetarian diet.,50
BE_WARE,Possible Typo,Be ware of the bears.,80
BE_WILL,Grammar,How is would this approach be useful?,50
BEAT_REGARDS,Possible Typo,"Beat Regards, Daniel",80
BECAUSE,Plain English,A national emergency exists by reason of the terrorist attacks.,
,,His lack of conversation is attributable to his shyness.,
,,Nader had to cancel his planned invasion in light of the fact that the Abdali Afghans had rebelled and invaded Khorasan.,
,,"The Stoors also had their own dialect of Hobbitish, owing to the fact that they spent some time in Dunland.",
,,"These two syndromes are usually referred to under one name, Wernicke–Korsakoff syndrome, due to the fact that they are part of the same etiology.",
BECAUSE_OF_I,Grammar,"Because of we didn't want a big train, but we want a fast train.",50
BECAUSE_OF_THE_FACT_THAT,Redundant Phrases,"Its crystals are usually hexagonal in shape, with flakiness and plating, usually because of the fact that it replaced a mineral.",
BECKON_CALL,Possible Typo,Don't expect me to be at your beckon call.,80
BED_ENGLISH,Possible Typo,Sorry for my bed English.,80
BEEN_PART_AGREEMENT,Grammar,I must have been always wrote that.,50
,,The software was introduce yesterday.,
BEFORE_HAND,Possible Typo,We packed before hand.,80
BEGS_BELIEF,Possible Typo,It begs belief that corporate policies can always pursue the best interests of a company.,80
BEING_BEGIN,Possible Typo,I was willing to risk begin interrogated about what I was going to do with the information.,80
,,"To being with, she is a Russian spy.",
BELATED,Plain English,They are on a belated honeymoon.,
BELIEF_BELIEVE,Commonly Confused Words,We belief that this is wrong.,
BELIEVE_BELIEF,Commonly Confused Words,It is my strong believe that something has to be changed.,
BELIEVE_TO_IN,Collocations,cause I believe to fitness.,
BEST_EVER,Redundant Phrases,Top ten best ever beer names.,
BETWEEN_PRP,Grammar,"His opposition to homosexuality causes tension between he and his gay roommate, Davis.",50
,,His opposition to homosexuality causes tension between I and Davis.,
,,His opposition to homosexuality causes tension between she and Davis.,
,,His opposition to homosexuality causes tension between they and Davis.,
BETWEEN_TO_AND,Collocations,Children between three to five are cute.,
BETWEEN_YOU_AND_I,Possible Typo,"Between you and I, there's no hope of survival.",80
BEWARE_PREPOSITION,Grammar,Beware about malware.,50
BEYOND_THE_PAIL,Possible Typo,His behavior was beyond the pail.,80
BIOGRAPHY_OF_A_LIFE,Redundant Phrases,"In this biography of her life, we get to share in the compelling story of a family’s struggles.",
BITTER_IN_TASTE,Redundant Phrases,This beer is bitter in taste.,
BIVOUAC_CAMP_BIVOUAC,Redundant Phrases,A rock climber leaves a hanging bivouac camp on an Arctic cliff,
BLEND_TOGETHER,Redundant Phrases,Their voices blend together in lovely harmony.,
BLIND_FOR_FROM,Collocations,blind for the fury.,
BLU_RAY,Commonly Confused Words,I ordered a Blu ray disk with their software.,
,,I ordered a Blu ray with their software.,
,,I ordered a Blu-ray disk with their software.,
,,I ordered a Blueray disk with their software.,
BOAST_FOR_OF,Collocations,He boasted for his skills.,
BOAT_MARINA,Redundant Phrases,Taupo Boat Marina,
BOB_WIRE,Commonly Confused Words,Building a bob wire fence,
BOLD_FACED,Commonly Confused Words,It was a bold-faced lie.,
BORED_OF,Possible Typo,I always get bored of people who talk about themselves.,80
BOTH_AS_WELL_AS,Grammar,He is both very rich as well as handsome.,50
BOTH_ENUM,Semantic,"It allows us to both grow, focus, and flourish.",
BOUQUET_OF_FLOWERS,Redundant Phrases,What a beautiful bouquet of flowers!,
BRAKE_AWAY_BREAK_AWAY,Commonly Confused Words,The should brake away from Russia.,
BREATHE_BREATH,Commonly Confused Words,I am not going to hold my breathe that he will do anything,
,,I could breath.,
,,I couldn't breath.,
,,We can not breath under water.,
BREW_HAHA,Possible Typo,What's all the brew haha about over there?,80
BRIEF_IN_DURATION,Redundant Phrases,"However, most wilderness programs are brief in duration.",
BRIEF_MOMENT,Redundant Phrases,A Brief Moment of Compassion,
BRING_AT_TO,Collocations,Bring Suzanne at the party.,
BRING_PUN_ON_THE_AGENDA,Collocations,We must bring to the agenda the people that are fed up of so many elections.,
BROUGHT_THEM_IN_THE_AIRPORT,Collocations,Friday came fast and the couple quitted their sweet house for took the bus who will brought them in the airport.,
BRUSSEL_SPROUT,Possible Typo,He left the last brussel sprout on his plate.,80
BUILD_OFF_OF,Possible Typo,Arcade Fire tried to build off of the success of their first album.,80
BUT_NEVERTHELESS,Redundant Phrases,"I should not have, but nevertheless I did.",
BUTTLOAD,Possible Typo,There was a buttload of cabbage left over.,80
