Rule,Category,Example,Score
BUY_VBG,Commonly Confused Words,We exploit these two features buy using Named Entity recognition.,
BY_DEFAULT_COMMA,Punctuation Errors,By default this setting is enabled.,
BY_EXAMPLE,Collocations,"By example, poor spelling makes pattern matching more difficult.",
BY_MEANS_OF,Plain English,Major forest areas are coming back by means of natural processes.,
BY_PASSIVE_PARTICIPLE_BE,Possible Typo,This can by consistent with usability constraints.,80
BYE_THE_WAY,Commonly Confused Words,"And bye the way, this program is open source.",
CA_PRP,Possible Typo,What ca I do?,80
,,You ca do it!,
CALENDER,Commonly Confused Words,"A calender is a system of organizing days for social, religious, commercial or administrative purposes.",
CAME_IN_INTO,Collocations,Judy came in the house after greeting her elders.,
CAN_ABLE_TO,Grammar,So you can able to download more apps regardless of the storage.,50
CAN_BACKUP,Possible Typo,Did you know you can backup your data on an external drive?,80
CAN_BLACKOUT,Possible Typo,You can blackout if you have any more to drink.,80
CAN_NOT,Possible Typo,You can not use the keyboard to select an item.,80
CAN_SETUP,Possible Typo,She can setup the tent in thirty seconds.,80
CAN_WHAT,Grammar,You should really how it works.,50
CAN_WORKOUT,Possible Typo,We can workout after we get lunch.,80
CANT,Possible Typo,I cant view pdf files in Explorer.,80
CANT_HELP_BUT,Grammar,I can't help but fall in love with you.,50
,,I cannot help but fall in love with you.,
CAPITALIZATION,Style,How many people died in world war II?,
,,She lived several years in south America.,
,,"Since 1914, cape cod has been separated from the mainland by the Cape Cod Canal.",
,,Some of the most prosperous neighbourhoods of the Netherlands can be found in the Hague.,
,,"The cape of good hope is a rocky headland on the Atlantic coast of the Cape Peninsula, South Africa.",
,,The middle ages is one of the three major periods in the most enduring scheme for analysing European history.,
,,What did you do on Valentine's day last year?,
,,What did you do on Veterans day last year?,
CAREFUL_FOR_WITH,Collocations,Be careful for the camera.,
CD_00_O_CLOCK,Nonstandard Phrases,It's 7:00 o'clock.,
,,It's 7:45 o'clock.,
CD_APOSTROPHE_S,Possible Typo,I have 5 CD's.,80
,,I have many CD's.,
CD_DISC,Redundant Phrases,I ordered a CD disk with their software.,
CD_DOZENS_OF,Grammar,You need two dozens of eggs.,50
CD_NN,Grammar,I have five book.,50
CD_WEEK_S,Possible Typo,"""he'll be sailing around the world in two week's time.",80
CDROM,Redundant Phrases,I ordered a Cdrom with their software.,
CHALK_FULL,Commonly Confused Words,Chalk full of mobile content,
CHANCE_CHANGE,Commonly Confused Words,Do not chance these settings!,
,,The climate chance must be stopped.,
CHOMPING_AT_THE_BIT,Possible Typo,The horses were all chomping at the bit.,80
CIRCUMSTANCES_SURROUNDING,Redundant Phrases,"Based upon this discussion, the OIG expanded the scope of its investigation to analyze the circumstances surrounding the settlement rejected by Judge Rakoff.",
CLEAN_UP,Commonly Confused Words,A full clean up is required.,
,,He promised to cleanup his room.,
CLEARLY_OR_OBVIOUSLY,Plain English,"Obviously, this is important.",
CLOSE_SCRUTINY,Redundant Phrases,The majority of Jannali's enterprises are located within close proximity to the suburb's railway station.,
,,Their manifesto yesterday received the same close scrutiny as the other two big parties — and it was an uncomfortable experience.,
CLOSER_FROM,Collocations,I moved in July to be closer from school.,
COARSE_COURSE,Commonly Confused Words,A coarse after action,
,,"In the syllabus for an Applied Mathematics coarse, students are told to write their problem sets individually.",
COLD_COULD,Possible Typo,Cold her father hear him?,80
,,Cold you hear him?,
,,This is all he cold do.,
,,This is all my father cold do.,
COLLECTIVE_NOUN_VERB_AGREEMENT_VBD,Grammar,A fleet of ships have been spotted.,50
COLLECTIVE_NOUN_VERB_AGREEMENT_VBP,Grammar,A fleet of ships are spotted.,50
COMBINE_TOGETHER,Redundant Phrases,Two things are combined together in this application.,
COME_IN_CAR,Collocations,She comes in car.,
,,She comes to work in car.,
COME_IN_TO,Collocations,"Finally, the boss called us all to come in her giant office for a meeting.",
COME_THROUGH,Possible Typo,They came throw the door.,80
COME_TO_PLANE,Collocations,I came to plane.,
COMFORTABLE_WITH_VBG,Redundant Phrases,I am not comfortable with dancing with strangers.,
COMMA_AFTER_A_MONTH,Punctuation Errors,"The store closed its doors for good in October, 1958.",
COMMA_BEFORE_AND,Punctuation Errors,She loves playing the piano and I hate it.,
COMMA_COMPOUND_SENTENCE,Punctuation Errors,Bill didn't work hard enough and so he failed.,
,,I need to borrow some money so I can buy some medicine for Tom.,
,,My friends are in Washington but I am in Seattle.,
,,She really purchased the car but she declined the extended warranty.,
COMMA_PARENTHESIS_WHITESPACE,Typography,"We had coffee , cheese and crackers and grapes.",
COMMA_TAG_QUESTION,Punctuation Errors,She isn't coming is she?,
COMMA_THAN,Commonly Confused Words,"If we want to eat, than we need to get some money.",
COMMA_WHICH,Punctuation Errors,I am going to the house which burned down.,
COMMON_BOND,Redundant Phrases,They formed a common bond against the British,
COMMUTE_BACK_AND_FORTH,Redundant Phrases,She will commute back and forth between New Haven and her home in Southern California before relocating to the Elm City this summer.,
COMP_THAN,Grammar,The tagger will return more as one tag.,50
,,The tagger will return more then one tag.,
,,This house is bigger then mine.,
COMPARISONS_AS_ADJECTIVE_AS,Possible Typo,We must do our job as best as we can.,80
COMPARISONS_NNS_THEN,Possible Typo,There were better companies then GE and Google.,80
COMPARISONS_THEN,Possible Typo,It was hotter then it'd ever been.,80
COMPLAIN_FOR_ABOUT,Collocations,The client complained for the service.,
COMPLAINS_COMPLAINTS,Commonly Confused Words,I do not understand why there are complains from our community.,
,,This is our biggest complain.,
COMPLAINT_COMPLIANT,Possible Typo,"If the rules are not fully complaint with the specification, post them here.",80
COMPLEMENT_COMPLIMENT,Possible Typo,She was complemented on her beautiful eyes.,80
COMPOSE_FROM_OF,Collocations,It is composed from carbohydrates and proteins.,
COMPRISE_OF,Possible Typo,It's tough to think you comprise of mostly water.,80
COMPRISED_CHIEFLY_OF,Possible Typo,The song was comprised chiefly of B chords.,80
COMPRISED_PRINCIPALLY_OF,Possible Typo,The lawsuit was comprised primarily of false accusations.,80
COMPRISES_OF,Possible Typo,The part comprises of the whole.,80
COMPRISING_OF,Possible Typo,This is a country comprising of independent people.,80
CONCENTRATE_WITH_ON,Collocations,"I know my life, it's not very interest because I am concentrated with my studies.",
CONFUSION_AWAIT_WAIT,Commonly Confused Words,"I can hardly await until "" Evidence "" arrives at my home.",
CONFUSION_DURING_FOR,Commonly Confused Words,I haven't seen him during ages.,
CONFUSION_OF_ADDICTING_ADDICITVE,Commonly Confused Words,Nicotine is the addicting drug in tobacco.,
CONFUSION_OF_ANOTHER_IN_OTHER,Commonly Confused Words,Let me say this another words.,
CONFUSION_OF_BEEN_BEING,Possible Typo,Stop been funny!,80
,,What doctrine are they been taught?,
CONFUSION_OF_CORRAL_CORAL,Commonly Confused Words,Corral reefs are diverse underwater ecosystems.,
CONFUSION_OF_DECENT_DESCENT,Commonly Confused Words,He is of Asian decent.,
,,Looking for a hotel with descent rooms.,
CONFUSION_OF_FOND_FUND,Possible Typo,A vulture fond is a...,80
CONFUSION_OF_GOLD_GOLF,Commonly Confused Words,She drove the gold cart.,
,,She is a golf medallist.,
,,She likes playing gold.,
CONFUSION_OF_HART_HEART,Commonly Confused Words,The questions of training and pay lie at the hard of the staffing problems.,
CONFUSION_OF_MARSHAL_MARTIAL,Commonly Confused Words,He is an experienced marshal artist.,
CONFUSION_OF_ME_I,Possible Typo,He gave it to Tim and I.,80
,,Her and I cheated on the test.,
,,Him and I cheated on the test.,
,,My mother and me went to California.,
,,Tim and me work together.,
CONFUSION_OF_OUR_OUT,Possible Typo,We evaluated out method by running RASP.,80
CONFUSION_OF_RIDE_RID,Possible Typo,Let's get rid if that broken chair.,80
,,Let's get ride of that broken chair.,
CONFUSION_OF_SAVE_SAFE_TO_IGNORE,Possible Typo,It is save to ignore trivial code when writing unit tests.,80
CONFUSION_OF_SOBBER_SOBER,Commonly Confused Words,I'm sobber.,
CONFUSION_OF_THEN_THAN,Possible Typo,It may be more expensive on some file systems then others.,80
,,She knows more then her colleagues.,
CONFUSION_OF_THESES_THESE,Possible Typo,Are theses scenes from a novel?,80
CONSENSUS_OF_OPINION,Redundant Phrases,"Wim Duisenberg, the ECB's Dutch president, is seen as a leader who seeks to fashion a consensus of opinion on the council rather than imposing his own views, as some chairmen of the US Federal Reserve have done.",
CONSEQUENCES_OF_FOR,Collocations,The new labour laws will have consequences on employees.,
CONSIST_TO_OF,Collocations,There is a program in medicine and this program consists to diagnostic people to know if their body works well.,
CONSTELLATION_PRIZE,Possible Typo,"The team was so upset, they didn't even claim their constellation prize.",80
CONSTITUTES_OF,Possible Typo,The city constitutes of five boroughs.,80
CONSTRUCTION_SIGHT,Possible Typo,We didn't visit the construction sight until Wednesday.,80
CONTINUE_TO_REMAIN,Redundant Phrases,We continued to remain optimistic.,
CONTRACT_CONTACT,Possible Typo,Please contract me as soon as possible.,80
COPYRIGHT,Typography,"Copyright (C) Joanna Bator, 2012",
COULD_CARE_LESS,Possible Typo,The man on the street said he could care less.,80
COULD_GIVE_A_DAMN,Possible Typo,"Frankly, my dear, I could give a damn.",80
COULD_OF,Commonly Confused Words,I should of finished it by now.,
COULDNT_CARELESS,Possible Typo,I couldn't careless.,80
COULDVE_IRREGULAR_VERB,Possible Typo,We could've ate the chicken.,80
COUNSEL_GENERAL,Commonly Confused Words,"Archer Blood, the counsel general in Dacca.",
COUNTLESS_OF,Collocations,There are countless of occurrences.,
COVER_BY_IN,Collocations,The Mountains are covered by snow.,
CRAZY_ON_WITH,Collocations,What makes me crazy on this dwelling is that some time we are higher than the clouds.,
CROWD_SOURCING,Possible Typo,Mechanical Turk is an example of crowd sourcing.,80
CURATOR_OF,Collocations,The man to whom you were speaking to was the curator on the exposition.,
CURE_AGAINST_FOR,Collocations,Researcher have found the cure against that type of cancer.,
CURE_FROM_OF,Collocations,This medicine will cure you from the disease.,
CURRENCY,Typography,You owe me 7.25$.,
CURRENCY_SPACE,Typography,You owe me $ 100.,
CURRENTLY,Plain English,I am currently employed.,
CURSING_THROUGH_VEINS,Possible Typo,It felt like the drugs were cursing through veins.,80
DAILY_REGIMENT,Possible Typo,They had a strict daily regiment of calisthenics.,80
DAMAGE_OF_TO,Collocations,It may cause damage of wildlife.,
DAMP_SQUID,Possible Typo,The last firework of the evening was a disappointing damp squid.,80
DARING-DO,Possible Typo,He impressed all the ladies with his daring-do.,80
DASH_RULE,Punctuation Errors,"- What is that, mother?",
,,"…— as aforementioned -,…",
,,In these educational establishments there were enrollments - mostly from elementary school — and a total of teachers.,
,,Vitorino Nemésio (1901 - 1978) — writer and university teacher.,
DATE_FUTURE_VERB_PAST,Semantic,We have visited the client on 10/27/2040.,
,,We have visited the client on 27/10/2040.,
,,We have visited the client on 7 October 2020.,
,,"We have visited the client on October 7, 2020.",
,,We visited the client on 10/27/2040.,
,,We visited the client on 27/10/2040.,
,,We visited the client on 7 October 2020.,
,,"We visited the client on October 7, 2020.",
DATE_NEW_YEAR,Semantic,IGD Convention - 7 October 2013,
,,"IGD Convention - October 7, 2013",
,,IGD Convention 2014 - 10/31/2013,
,,IGD Convention 2014 - 2013-10-31,
,,IGD Convention 2014 - 31/10/2013,
DATE_WEEKDAY,Semantic,"IGD Convention - Monday, 7 October 2014",
,,"IGD Convention - Monday, October 7, 2014",
,,"IGD Convention 2014 - Monday, 10/31/2014",
,,"IGD Convention 2014 - Monday, 2014-10-31",
,,"IGD Convention 2014 - Monday, 31/10/2014",
DATE_WEEKDAY_WITHOUT_YEAR,Semantic,"IGD Convention - Monday, 7 October",
,,"IGD Convention - Monday, October 7",
,,"IGD Convention 2014 - Monday, 10/31",
,,"IGD Convention 2014 - Monday, 31/10",
DE_FACTOR,Possible Typo,There was a de factor ban on cigarettes.,80
DE_JURO,Possible Typo,There is no de juro segregation allowed by law anywhere in the United States.,80
DEATH_NAIL,Possible Typo,The fall of the Berlin Wall was the death nail for the USSR.,80
DECEASE_DISEASE,Commonly Confused Words,He has a deadly decease.,
DEEP_SEEDED,Commonly Confused Words,He has a deep-seeded infection.,
DEER_DEAR,Commonly Confused Words,"Deer Anne,...",
DEFUSE_BOMB,Commonly Confused Words,How long did it take you to diffuse the bomb?,
DEGREE_CHANGE,Possible Typo,She made a 360 degree change in her life.,80
DEPARTURE_OF_FROM,Collocations,The stay is finally ended and they prepared their departure of New York.,
DEPEND_ON,Grammar,He depends you.,50
DEPENDENT,Commonly Confused Words,They are dependant on the results,
DEPRIVE_FROM_OF,Collocations,This soil is deprived from nutrients.,
DESCEND_DOWN,Redundant Phrases,The Pentagon aides and journalists descend down the back stairs of the plane as is customary while Rumsfeld comes down the main stairs to meet his welcome party.,
DESERT_DESSERT,Commonly Confused Words,The criminal will get his just desserts.,
DESIRE_ON_FOR,Collocations,"Even though some businessmen prefer unusual approaches to boost up their business identification, they get interested to identify the best approach to realize their desires on the business development.",
DESPITE_OF,Grammar,He kept running despite of the pain in his chest.,50
DESPITE_THE_FACT,Plain English,He still loves her despite the fact that she cheated on him.,
,,He still loves her in spite of the fact that she cheated on him.,
DID_BASEFORM,Grammar,Mozilla should has a grammar checker.,50
,,Since he does not really has any connection with us...,
,,Since he doesn't has any connection with us...,
,,They will comes home.,
DID_PAST,Grammar,Did the application worked?,50
,,Did you forgot it?,
DIE_DICE,Grammar,I had a dice in my hand.,50
DIE_FROM_OF,Collocations,The ferns are dying from too much watering.,
DIFFERENCE_ABOUT_BETWEEN,Collocations,There is not big difference about the week and the weekend to me.,
DIFFERENT_TACT,Possible Typo,We'll have to try a different tact.,80
DIFFICULT_TO_ME,Collocations,Studying grammar is difficult to me.,
DIFFUSE_TENSIONS,Commonly Confused Words,They gathered at her police precinct to thank officers for their work and to diffuse tensions.,
DIRECTLY_ANTITHETICAL,Redundant Phrases,The two events this week were directly antithetical to the University's values for these reasons.,
DISAPPOINT_FROM,Collocations,She was disappointed from the surprise.,
DISAPPOINTED_OF,Collocations,We could be disappointed of this announcement.,
DISC_BREAK,Possible Typo,The rear wheels are disc break.,80
DISCUSS_ABOUT,Grammar,Do you have a few minutes to discuss about this project?,50
DISCUSSIONS_AROUND,Possible Typo,They had many discussions around politics.,80
DIVERSITY_OF,Collocations,The diversity nature of this work is appealing to many.,
DIVIDE_IN_INTO,Collocations,Divide the pizza in four.,
DO_A_PARTY,Collocations,"A new roommate has moved in, so we decided to do a party with all of us..",
,,I like making a party.,
DO_ARTS,Collocations,My sister plays ballet at the community center.,
DO_HAVE_A_MEETING,Collocations,We decided to do a meeting the next day.,
DO_TO_THE_FACT_THAT,Commonly Confused Words,"Do to the fact that the MTA has burned through leaders at a rate of nearly one per year over the last six years, ...",
DO_VBZ,Grammar,Do you tried this?,50
DO_YOU_WHAT,Grammar,Do you why she left him?,50
DOE_SNOT,Possible Typo,This doe snot mean that I like you.,80
DOES_NP_VBZ,Grammar,Does your memory usage grows during processing?,50
DOES_X_HAS,Grammar,He does not has expertise about that.,50
DOES_XX_CAN,Grammar,Does someone can reproduce what I described before?,50
DOES_YOU,Grammar,But Does you have your glasses?,50
,,Does you have your glasses?,
DONT_NEEDS,Grammar,I do not needs help with that.,50
,,I don't needs help with that.,
DONT_WHAT,Grammar,One problem is that you often don't where a sentence starts and ends.,50
DONT_WILL,Grammar,I don't will do that.,50
DOOR_JAM,Possible Typo,There were scratches all along the door jam.,80
DOUBLE_NEGATIVE,Grammar,I didn't see nothing.,50
,,Nobody told me nothing.,
,,She could not hardly understand a word.,
,,She couldn't hardly understand a word.,
,,She hasn't seen nobody.,
,,You shouldn't have not done it!,
,,You shouldn't not do it!,
DOUBLE_PUNCTUATION,Punctuation,(empty),
DOUBT_FOR_IN,Collocations,I doubt for that.,
DOWN_SIDE,Possible Typo,There was no serious down side to the plan.,80
DOWNPAYMENT,Possible Typo,The couple made their first downpayment on their new house.,80
DRAW_ATTENTION,Plain English,We'd like to draw your attention to the last picture.,
,,Your attention is drawn to the last page.,
DRESS_WITH_IN,Collocations,Jane dresses with a coverall.,
DT_BAIL_OUT,Possible Typo,The bail out was too expensive.,80
DT_DT,Grammar,I like a this dog.,50
,,The 'an international movie' is interesting.,
,,The a thing is this.,
DT_JJ_NO_NOUN,Grammar,An absurd is making my existence meaningless.,50
,,This is an absurd.,
DT_PRP,Grammar,"Strode past the now frightened man, entered the he house.",50
DT_RESPONDS,Possible Typo,Thanks for the responds.,80
DT_VBZ_THEYRE_NN,Possible Typo,"And if another is they're boyfriend, I will be angry.",80
DUE_TO_THE_FACT,Plain English,The experiment was halted due to the fact that funding was withdrawn.,
DURING_OVER_THE_WEEKENDS,Collocations,"During the week, I go to school and I work in a pet shop during the week end.",
,,"During the week, I go to school and I work in a pet shop during the weekend.",
,,I only speak English on weekends because during weekends I work and some clients that only speak in English.,
DURING_THE_COURSE_OF,Redundant Phrases,He never smiled during the course of the trial.,
E_PRIME_LOOSE,Creative Writing,This is right.,100
E_PRIME_STRICT,Creative Writing,This is wrong.,100
EACH_AND_EVERY,Redundant Phrases,God bless each and every one of you!,
EACH_AND_EVERY_NOUN,Plain English,You better check each and every door.,
EACH_EVERY_NNS,Grammar,Each children are happy.,50
EACH_OTHERS,Grammar,They checked each others’ work.,50
EAGER_TO,Grammar,Bangladesh is eager to buying cars from Iran.,50
EARLY_ADAPTER,Nonstandard Phrases,DualCore PC is available for purchase for selected companies in the early adapter program.,
EASE_EASY,Commonly Confused Words,This looks pretty ease to me.,
EASE_OFF_USE,Commonly Confused Words,Increase ease off use.,
EASIEST_WAS_TO,Possible Typo,What is the fastest was to learn Spanish?,80
ECONOMIC_ECONOMICAL,Commonly Confused Words,This is a very economic car.,
ECONOMICAL_ECONOMIC,Commonly Confused Words,This article deals with economical development of the Third World.,
EG_NO_COMMA,Punctuation Errors,"There are several grammar checkers for English, e.g. LanguageTool.",
,,"There are several grammar checkers for English, eg LanguageTool.",
,,"There are several grammar checkers for English, eg. LanguageTool.",
EG_SPACE,Punctuation Errors,"There are several grammar checkers for English, e. g. LanguageTool.",
,,"Who's responsible for providing public facilities, i. e., a post office, library, etc. for the Northwest?",
EGG_YOKE,Commonly Confused Words,Chocolate mousse with egg yoke,
ELDER_OLDER,Possible Typo,She is elder than her brother.,80
ELLIPSIS,Typography,This is important . . . as far as I know.,
ELUDED_TO,Possible Typo,He eluded to engagement at the party.,80
EMPHATIC_REFLEXIVE_PRONOUNS,Plain English,I cannot do it for you. Only you yourself can do it.,
,,I cannot do it for you. Only you yourselves can do it.,
,,The software update is not correct. It itself causes more problems than in solves.,
,,There are no biscuits. I myself ate the last one.,
,,They cannot do it for us. We ourselves must do it.,
,,You cannot do it for her. Only she herself can do it.,
,,You cannot do it for him. Only he himself can do it.,
,,You cannot do it them. Only they themselves can do it.,
EMPTY_LINE,Style,(empty),
EN_A_VS_AN,Miscellaneous,The train arrived a hour ago.,
EN_COMPOUNDS,Miscellaneous,I now have a part time job.,
EN_CONTRACTION_SPELLING,Possible Typo,We havent earned anything.,80
EN_DASH_RULE,Miscellaneous,(empty),
EN_MASS,Commonly Confused Words,HP Already Shipping Linux en mass,
EN_QUOTES,Typography,„Test”.,
,,``Test”.,
,,"This is a (""test"")",
,,"This is a (""test"").",
EN_UNPAIRED_BRACKETS,Punctuation,"""I'm over here, she said.",
EN_WORD_COHERENCY,Miscellaneous,"He likes archaeology. Really? She likes archeology, too.",
END_RESULT_OR_PRODUCT,Plain English,The end result is clear.,
ENGLISH_WORD_REPEAT_BEGINNING_RULE,Style,"Moreover, the street is almost entirely residential. Moreover, it was named after a poet.",
ENGLISH_WORD_REPEAT_RULE,Miscellaneous,This is is just an example sentence.,
ENGLISH_WRONG_WORD_IN_CONTEXT,Commonly Confused Words,I have proscribed you a course of antibiotics.,
ENROLLED_IN_FOR,Collocations,He enrolled at the college.,
ENTER_IN,Collocations,"While he was entering in the room, he felt an uncomfortable feeling on his spine.",
ENTIRELY_COMPRISED_OF,Possible Typo,It was entirely comprised of people.,80
ENUMERATION_AND_DASHES,Punctuation Errors,1.- Introduction,
ENVELOPE_ENVELOP,Possible Typo,The smell started to envelope me.,80
EQUALLY_AS,Grammar,This model is equally as effective.,50
ESSENTIAL_ESSENTIALLY,Grammar,This is essential the same work,50
ESTABLISHED_FACT,Redundant Phrases,This is an established fact.,
ET_AL,Possible Typo,Thelen et al 2001,80
,,Thelen et. al. 2001,
ET_ALL,Commonly Confused Words,"In the recent paper by Shakespeare et all, it is argued that envy is not unique to primates.",
EUPUB_ACTION,Misused terms in EU publications (Gardner),Action 1 Measure 1.1 - Town twinning citizens' meetings - EUR 5896000,
EUPUB_ACTOR,Misused terms in EU publications (Gardner),… which have been supported by the EU and endorsed by various international actors.,
EUPUB_ACTORNESS,Misused terms in EU publications (Gardner),EU Actorness in International Affairs: The Case of EULEX Mission in Kosovo.,
EUPUB_ACTUAL,Misused terms in EU publications (Gardner),This appropriation is… based on the actual regulations and on the probable adjustments.,
EUPUB_ADEQUATE,Misused terms in EU publications (Gardner),The collection of the data should be adequate and proportionate to the objectives pursued.,
EUPUB_AGENDA,Misused terms in EU publications (Gardner),Three agendas were found in the meeting room.,
,,Write the time of the meeting in your agenda.,
EUPUB_AGENT,Misused terms in EU publications (Gardner),The problem of vacancies mainly concerns contract agents.,
EUPUB_AIDS,Misused terms in EU publications (Gardner),State aids — Decisions to propose appropriate measures pursuant to Article 108(1).,
EUPUB_AIM,Misused terms in EU publications (Gardner),List of specific recommendations from the Commission with the aim to reduce the administrative burden of REACH by SMEs.,
EUPUB_ALLOW_PERMIT_ENABLE_TO,Misused terms in EU publications (Gardner),The statistics available do not allow to take account of all these situations.,
EUPUB_ANGLO_SAXON,Misused terms in EU publications (Gardner),The Anglo-Saxon group of agencies are…,
EUPUB_ANIMATE,Misused terms in EU publications (Gardner),The Commission is looking for a head of sector to animate 12 staff members.,
EUPUB_ANTI,Misused terms in EU publications (Gardner),These threats are outlined in the framework of the Commission anti-cyber crime policy.,
EUPUB_ARTICULATE_ARTICULATION,Misused terms in EU publications (Gardner),"The European Parliament… urges Turkey to articulate with the Iraqi Government, and other neighbours, …",
,,This includes an appropriate articulation with the Cohesion policy funds.,
EUPUB_ASSIST_AT,Misused terms in EU publications (Gardner),Officials of the Commission assist at the meetings of the Committee and the working groups.,
EUPUB_ATTESTATION,Misused terms in EU publications (Gardner),… is a necessary and sufficient condition for an attestation of conformity.,
EUPUB_ATTRIBUTE,Misused terms in EU publications (Gardner),The contracting authority can attribute a contract to the company if…,
,,The contracts were attributed on 21 March.,
EUPUB_AXIS,Misused terms in EU publications (Gardner),… shall be calculated by applying the co-financing rate for each priority axis laid down by the Commission decision.,
EUPUB_BADGE,Misused terms in EU publications (Gardner),New topping up system for your children's badges at the European School.,
EUPUB_BOVINE_OVINE_CAPRINE_PORCINE_ASININE_ANIMALS,Misused terms in EU publications (Gardner),… and asinine animals.,
,,… and caprine fresh meat.,
,,… and porcine fresh meat.,
,,… as regards model certificates relating to the importation of bovine animals for slaughter and…,
,,… as regards model certificates relating to the importation of ovine animals for slaughter and…,
EUPUB_BUDGET_LINE,Misused terms in EU publications (Gardner),"These are DG and Culture (DG EAC) for budget line 15, …",
EUPUB_CABINET,Misused terms in EU publications (Gardner),Go to the British cabinet.,
EUPUB_CASE,Misused terms in EU publications (Gardner),Farmers are… subject to possible reduction of the grubbing-up premium in case of non-compliance with certain requirements.,
